{
  "$schema": "https://json-schema.org/draft/2020-12/schema",
  "title": "Deals (money)",
  "description": "Reported values are press estimates.",
  "type": "array",
  "items": {
    "type": "object",
    "required": [
      "id",
      "clubId",
      "orgName",
      "sponsorId",
      "placement",
      "from",
      "to",
      "value",
      "source"
    ],
    "additionalProperties": false,
    "properties": {
      "id": {
        "type": "string",
        "pattern": "^[a-z0-9]+(-[a-z0-9]+)*$"
      },
      "clubId": {
        "anyOf": [
          {
            "type": "string",
            "pattern": "^[a-z0-9]+(-[a-z0-9]+)*$"
          },
          {
            "type": "null"
          }
        ]
      },
      "orgName": {
        "type": [
          "string",
          "null"
        ]
      },
      "sponsorId": {
        "type": "string",
        "pattern": "^[a-z0-9]+(-[a-z0-9]+)*$"
      },
      "placement": {
        "enum": [
          "front",
          "back",
          "sleeve",
          "shorts",
          "stadium",
          "partner",
          "league-partner",
          "training-kit"
        ]
      },
      "from": {
        "type": [
          "string",
          "null"
        ],
        "pattern": "^[0-9]{4}(-[0-9]{2})?$"
      },
      "to": {
        "type": [
          "string",
          "null"
        ],
        "pattern": "^[0-9]{4}(-[0-9]{2})?$"
      },
      "value": {
        "type": [
          "object",
          "null"
        ],
        "required": [
          "amount",
          "currency",
          "unit",
          "per",
          "upTo",
          "usdApprox"
        ],
        "properties": {
          "amount": {
            "type": "number"
          },
          "currency": {
            "enum": [
              "GBP",
              "EUR",
              "USD"
            ]
          },
          "unit": {
            "type": "string"
          },
          "per": {
            "type": "string"
          },
          "upTo": {
            "type": "boolean"
          },
          "usdApprox": {
            "type": [
              "number",
              "null"
            ]
          }
        }
      },
      "source": {
        "type": [
          "object",
          "null"
        ],
        "required": [
          "name",
          "date",
          "url"
        ],
        "additionalProperties": false,
        "properties": {
          "name": {
            "type": "string"
          },
          "date": {
            "type": "string"
          },
          "url": {
            "type": [
              "string",
              "null"
            ]
          },
          "note": {
            "type": "string"
          }
        }
      },
      "note": {
        "type": "string"
      }
    }
  }
}